{
  "id": "01J0000000000000000MESSAG1",
  "session_id": "01J0000000000000000SESSION",
  "turn_id": "01J00000000000000000TURN01",
  "role": "user",
  "content": "Describe this screenshot.",
  "tool_calls": null,
  "tool_call_id": null,
  "actor_name": "Caelum",
  "actor_role": "orchestrator",
  "attachments": [{ "content_ref": "cnt_01HZ", "mime_type": "image/png" }],
  "created_at": "2026-07-28T00:00:02Z"
}
